Name,Since,Category,Strength,Years,Board,Phone No,Fee,Location,Faculty,Sports,Amenities
Ravindra Bharathi Global School,2012,Day Schools,472,Nursery - Class 10,CBSE,tel:+918035470244,73800 / Annual,"7th Cross, 92/1, Tulsi Theater Rd, Marathahalli Village, Marathahalli, Bengaluru, Karnataka 560037, India",,,Transport
Kaveri Gnana Mithra School,2003,Day Schools,750,Nursery - Class 10,State Board,tel:+918035470244,24000 / Annual,"9th Main Rd, Kaveri Layout, Marathahalli Village, Marathahalli, Bengaluru, Karnataka 560037, India",,,Transport
Carmel School,1986,Day Schools,1800,Nursery - Class 10,"ICSE, State Board",tel:+918035470244,85000 / Annual,"Puttalingiah Rd, Banashankari Stage II, Padmanabhanagar, Bengaluru, Karnataka 560070, India",,,Transport
N S V K P,Day Schools,N/A,Nursery - Class 10,State Board,Co-Education,tel:+918035470244,38000 / Annual,"50 Feet Road, near B S N L Office, Padmanabhanagar, Bengaluru, Karnataka 560070, India",,,Transport
PRARTHANA SCHOOL,2008,Day Schools,N/A,Pre-Nursery - Class 10,"CBSE, State Board",tel:+918035470244,55000 / Annual,"NO 17/17A, Prarthana School, Subramanya Pura Rd, RR Layout, Padmanabhanagar, Bengaluru, Karnataka 560061, India",,,Transport
cambridge school,Day Schools,N/A,Nursery - Class 10,State Board,Co-Education,tel:+918035470244,10000 / Annual,"83/2, Bangalore - Mysore Road, Ramachandra Agrahara, Azad Nagar, Bengaluru, Karnataka 560018, India",,,
MAMATA ENGLISH SCHOOL,Day Schools,N/A,-,State Board,Co-Education,tel:+918035470244,18000 / Annual,"XH44+VF3, 2nd Main Rd, Valmiki Nagar, Ramachandra Agrahara, Azad Nagar, Bengaluru, Karnataka 560018, India",,,
YM Public School,Public Schools,,Pre School - 12,CBSE,Co-Education,tel:+918035470244,,,,"Athletics, Badminton, Basketball, Throwball, Volleyball, Yoga","Transport, Medical Facility, Laboratory, Smart Classrooms, Computers Facility, Library"
Vera International Preschool & Childcare,2022,Play Schools,100,Pre School - PRE,"International Baccalaureate, Montessori",tel:+918035470244,,"Sy.No.17/1, Outer Ring road, Opp. to Prestige Cessna Park, Marathahalli-Bellandur Outer Ring Road, Kadubeesanahalli, Varthur Hobli, Bangalore, Bengaluru, Karnataka",,,Transport
Your Kids R Our Kids,N/A,Play Schools,N/A,Pre School - PRE,Other Boards,tel:+919513238818,125000,"Prestige Tech Park Rd, Kadubeesanahalli, Bengaluru, Karnataka 560103",,Yoga,Smart Classrooms
Sri Anandamma Devi Vidya Mandir,Day Schools,N/A,Nursery - Class 10,State Board,Co-Education,tel:+918035470244,16000 / Annual,"WH55+FJ7, 1st Stage, BDA Park, Bengaluru, Karnataka 560078, India",,,
CLEVER LAND SCHOOL,Day Schools,300,Pre-Nursery - Class 10,State Board,Co-Education,tel:+918035470244,35000 / Annual,"1st Main Rd, Kothnur Main Rd, Nataraja Layout, Kothnoor Dinne, 8th Phase, J. P. Nagar, Bengaluru, Kothnur, Karnataka 560078, India",,,
Prasiddhi School,1991,Day Schools,500,Nursery - Class 10,State Board,tel:+918035470244,70000 / Annual,"Palace Compound, Palace Grounds Inner Rd, Vasanth Nagar, Bengaluru, Karnataka 560052, India",,,Transport
Gulabi Girls High School,1967,Day Schools,N/A,Nursery - Class 10,State Board,tel:+918035470244,40000 / Annual,"5/1, 5th Main Rd, Jayamahal Extension, Jayamahal, Bengaluru, Karnataka 560046, India",,,Transport
Little Elly Preschool,2004,Play Schools,N/A,Pre School - PRE,Other Boards,tel:+919513238818,45000,"187, 4th Main Rd, NGEF Layout, Sadanandanagar, Bennigana Halli, Bengaluru, Karnataka 560038",Mr. Vittal Bhandary Founder / N/A,Yoga,
EuroKids,2001,Play Schools,N/A,Pre School - PRE,Other Boards,tel:+919513238818,40000,"466, 7th Main, Sadanand Nagar, near Bharani sweets, NGEF Layout, Bengaluru, Karnataka 560038",,Yoga,"Transport, Smart Classrooms"
FLORENCE HIGH SCHOOL,1978,Day Schools,N/A,Nursery - Class 10,State Board,tel:+918035470244,32000 / Annual,"2J37+MV9, 22/2, Viviani Rd, Richards Town, Bengaluru, Karnataka 560005, India",,,
ST.ALPHONSUS HIGH SCHOOL,1956,Day Schools,N/A,-,State Board,tel:+918035470244,15000 / Annual,"2J47+GV9, Davis Rd, St Thomas Town, Richards Town, Bengaluru, Karnataka 560084, India",,,
ALFA PUBLIC SCHOOL,Day Schools,320,Nursery - Class 10,CBSE,Co-Education,tel:+918035470244,40000 / Annual,"237, 8th Cross Rd, near Citizen School, Pillanna Garden, 1st Stage, Richards Town, Bengaluru, Karnataka 560084, India",,,Transport
NUSRATH FATIMA ENGLISH SCHOOL,Day Schools,N/A,-,Other Boards,Co-Education,tel:+918035470244,20000 / Annual,"No 46/B, Davis Road, Davis Road, Bengaluru, Karnataka",,,
Orchids The International School,Day Schools,N/A,Nursery - Class 10,CBSE,Co-Education,tel:+918035470244,80000 / Annual,"24-39, 7th Main Rd, 4th Cross, Navodaya Nagar, JP Nagar 7th Phase, J. P. Nagar, Kothnur, Karnataka 560078, India",,,
BANGALORE SCOTTISH SCHOOL,2002,Day Schools,600,Nursery - Class 10,CBSE,tel:+918035470244,80000 / Annual,"24-39, 7th Main Rd, 4th Cross, Navodaya Nagar, JP Nagar 7th Phase, J. P. Nagar, Kothnur, Karnataka 560078, India",,,Transport
Kids Castle Preschool,2000,Play Schools,N/A,Pre School - PRE,Other Boards,tel:+919513238818,45000,"Kids Castle Preschool, Abbaiah Reddy Layout, House No. 7, 1st Cross Rd, Nagappareddy Layout, Vignan Nagar, Doddanekundi, Kaggadasapura, Bengaluru, Karnataka 560037","Mrs. Shweta Aneja Founder Director / B.Ed, B.Com, B.SC.",Yoga,Smart Classrooms
ORCHIDS INTERNATIONAL SCHOOL,Day Schools,N/A,Nursery - Class 5,CBSE,Co-Education,tel:+918035470244,82700 / Annual,"486, 11th Cross Rd, Nagarbhavi Second Stage, 6 Block, Annapoorneshwari Nagar, Sunkadakatte, Bengaluru, Karnataka 560091, India",,,Transport
Poddar Jumbo Kids,1927,Play Schools,70,Pre School - PRE,Other Boards,tel:+919513238818,33000,"#153 , 5th Main Road, Annapoorneshwari Layout,(opp.Press Layout),, Ullal Main Road,( Near Vidaynikethan School), Bengaluru, Karnataka 560056",,Yoga,
Podar Jumbo Kids Plus,1927,Other Collections,N/A,Pre School - PRE,Other Boards,tel:+919513238818,45000,"#153 , 5th Main Road, Annapoorneshwari Layout,(opp.Press Layout),, Ullal Main Road,( Near Vidaynikethan School), Bengaluru, Karnataka 560056",,Yoga,
Shanti Juniors,N/A,Play Schools,,Pre School - PRE,Other Boards,tel:+919513238818,,"No.303 , 2nd Main, 1st Cross Street, RHCS Layout, Annapoorneshwari Nagar, Bengaluru, Karnataka 560091",Shri Ved Prakash Chiripal Chairman / N/A,Yoga,
New Pratham Public School,2010,Day Schools,500,Nursery - Class 10,CBSE,tel:+918035470244,40000 / Annual,"XMR8+VJC, 2nd Main Rd, Pai Layout, Mahadevapura, Bengaluru, Karnataka 560016, India",,,Transport
Young Indian School,1995,Day Schools,N/A,Nursery - Class 8,State Board,tel:+918035470244,20000 / Annual,"163/1/A, 7th Main Rd, NGEF Layout, Sadanandanagar, Bennigana Halli, Bengaluru, Karnataka 560038, India",,,
Vyasa International School,2008,Day Schools,850,Nursery - Class 12,CBSE,tel:+918035470244,85000 / Annual,"No.101/2, BEL North Gate, Doddabommasandra, Vidyaranyapura, Post, Bengaluru, Karnataka 560097, India",,,Transport
Shri L.N Vidya Mandir,Day Schools,N/A,Nursery - Class 10,"State Board, CBSE",Co-Education,tel:+918035470244,20000 / Annual,"#, L.K.R Nagar, 34, 1st Cross Lakeshore Gdns, Devinagar, Bengaluru, Karnataka 560094, India",,,
Bishop Sergeant Central School,2004,Day Schools,N/A,Nursery - Class 10,State Board,tel:+918035470244,25000 / Annual,"11/1, Devinagar Main Rd, Stage II, Lottegollahalli, Devinagar, Devinagar, Bengaluru, Karnataka 560094, India",,,Transport
SRK Indian School,1989,Day Schools,N/A,Nursery - Class 12,State Board,tel:+918035470244,40000 / Annual,"3H6F+CJJ, Hanumaiah Layout, Kodigehalli, Bengaluru, Karnataka 560092, India",,,
BISHOP SEAGENT CENTRAL SCHOOL,Day Schools,N/A,Nursery - Class 10,ICSE,Co-Education,tel:+918035470244,45000 / Annual,"11/1, Devinagar Main Rd, Stage II, Lottegollahalli, Devinagar, Devinagar, Bengaluru, Karnataka 560094, India",,,Transport
Shri Channakeshava School,1973,Day Schools,N/A,LKG - Class 10,State Board,tel:+918035470244,35000 / Annual,"867, Hosa Rd, Chennakeshava Nagar, Pragathi Nagar, Basapura, Bengaluru, Karnataka 560100, India",,,Transport
Stella Merrys School,Day Schools,N/A,Nursery - Class 10,State Board,Co-Education,tel:+918035470244,20000 / Annual,"#19 5th cross, Uttarahalli Main Rd, beside srinivasa theatre, Gowdanapalya, subramainyapura post, Bengaluru, Karnataka 61, India",,,
Heritage Public School,2004,Day Schools,500,Nursery - Class 10,CBSE,tel:+918035470244,32000 / Annual,"Kotnur Main Road, VHJF+H92, 8th Cross Rd, Srinidhi Layout, 8th Phase, J. P. Nagar, Bengaluru, Karnataka 560062, India",,,Transport
Sanmarg Central School,2005,Day Schools,232,Pre-Nursery - Class 10,CBSE,tel:+918035470244,72000 / Annual,"#17 & 18, 8th Main Rd, Srinidhi Layout, 8th Phase, Konanakunte, Bengaluru, Kothnur, Karnataka 560062, India",,,Transport
GLITZY PUBLIC SCHOOL,Day Schools,N/A,Nursery - Class 10,"State Board, State Board",Co-Education,tel:+918035470244,26000 / Annual,"2nd Cross, 2nd Main, Near To Raghavendra Swamy Temple, Behind Brigade Gardenia, Konanakunte, Chunchugatta, Kotnunor Main Road, Sheryas Colony, Annapoorneshwari Layout, JP Nagar 7th Phase, J. P. Nagar, Bengaluru, Kothnur, Karnataka 560042, India",,,
GNANA JYOTHI PRIMARY HIGH SCHOOL,Day Schools,400,Nursery - Class 10,State Board,Co-Education,tel:+918035470244,30000 / Annual,"WARD NO 57, SOUTH BLOCK 1, JP NAGAR, Near Chirag hospital, central mall, Bengaluru, Karnataka",,,Transport
Jnana Vikas Public School,Day Schools,600,Pre-Nursery - Class 10,"CBSE, State Board",Co-Education,tel:+918035470244,50000 / Annual,"No 35, 2nd Main, 2nd cross,SriKrishna Nagar J P J, P Main Road, Navodaya Nagar, 8th Phase, J. P. Nagar, Bengaluru, Kothnur, Karnataka 560076, India",,,Transport
GARDEN ENGLISH SCHOOL,Day Schools,N/A,LKG - Class 10,State Board,Co-Education,tel:+918035470244,20000 / Annual,"2nd Main Road, Vittal Nagar, Vittal Nagar, Hanumanth Nagar, Azad Nagar, Bengaluru, Karnataka 560026, India",,,
St.Marys English High School,Day Schools,N/A,Pre-Nursery - Class 10,"CBSE, State Board",Co-Education,tel:+918035470244,20000 / Annual,"2JXW+XXF, Hennur Bagalur Main Rd, Rammana Layout, Byrathi, Karnataka 560077, India",,,Transport
Vibgyor High School,2004,Day Schools,N/A,Nursery - Class 7,"ICSE, CBSE",tel:+918035470244,170500 / Annual,"Survey No. 60/1-60/2, Byrathi Village, Blessing Garden Layout, Near Cratis Hospital, Gedhalahalli, Hennur Main Rd, Rammana Layout, Bengaluru, Byrathi, Karnataka 560077, India",,,Transport
New Baldwin School,2002,Day Schools,1000,Nursery - Class 10,ICSE,tel:+918035470244,50000 / Annual,"Gedalahalli K. Narayanapura Cross, Hennur Bagalur Main Rd, Geddalahalli, Rammana Layout, Kothanur, Bengaluru, Byrathi, Karnataka 560077, India",,,Transport
GOOD HOPE ENGLISH SCHOOL,Day Schools,N/A,Nursery - Class 10,State Board,Co-Education,tel:+918035470244,30000 / Annual,"2J33+V4R, 7, 9th Cross Road, Mudamma Garden, Krishnappa Garden, Chinnapa Garden, Benson Town, Bengaluru, Karnataka 560046, India",,,
Sri Ayyappan School & ITI,Day Schools,N/A,Nursery - Class 10,State Board,Co-Education,tel:+918035470244,25000 / Annual,"234, Ramaswamipalya, Chinnapa Garden, Benson Town, Bengaluru, Karnataka 560046, India",,,
BLUEBELL PUBLIC SCHOOL,2005,Day Schools,380,Nursery - Class 10,State Board,tel:+918035470244,22000 / Annual,"G.K. Layout,Chennakeshava Nagar, 100, 14th Main Rd, Manjunatha Nagar, Sai Sree Layout, Parappana Agrahara, Bengaluru, Karnataka 560100, India",,,Transport
Sujana Convent,2000,Day Schools,N/A,Nursery - Class 10,State Board,tel:+918035470244,35000 / Annual,"13th Cross G.K Layout CK Nagar, Manjunatha Nagar, Hosa Road, Sai Sree Layout, Parappana Agrahara, Bengaluru, Karnataka 560100, India",,,Transport
AYESHA ENGLISH PRIMARY SCHOOL,1975,Day Schools,N/A,Nursery - Class 10,State Board,tel:+918035470244,35000 / Annual,"XH33+GCJ, Vittal Nagar, Adarsha Nagar, Azad Nagar, Bengaluru, Karnataka 560026, India",,,
Periwinkle Preschool and Daycare,2011,Play Schools,N/A,Pre School - PRE,Other Boards,tel:+919513238818,39100,"111, 11th Main Rd, 1st Block, Dasarhalli, Srinagar, Banashankari, Bengaluru, Karnataka 560050",,Yoga,
RMS International School,2010,Day Schools,950,Nursery - Class 10,CBSE,tel:+918035470244,60000 / Annual,"no 18, Srinivasa Industrial Estate,, 18, Kanakapura Rd, next to Metro, Mango Garden Layout, Bikasipura, Bengaluru, Karnataka 560078, India",,,Transport
Poddar Jumbo Kids,1927,Play Schools,50,Pre School - PRE,Other Boards,tel:+919513238818,72000,"14th Cross Rd, Vikram Nagar, ISRO Layout, Bengaluru, Karnataka 560078",,Yoga,
ST. ALPHONSUS HIGH SCHOOL,Day Schools,N/A,Nursery - Class 10,Other Boards,Co-Education,tel:+918035470244,15000 / Annual,"DAVIS ROAD, SAGAYAPURA, RICHARDS TOWN, Bengaluru, Karnataka",,,
HAL GNANAJYOTI SCHOOL,Day Schools,N/A,Nursery - Class 10,ICSE,Co-Education,tel:+918035470244,120000 / Annual,"GBJ 195, New Township, 3rd Main Rd, 7th Cross Rd, Jawahar Nagar, HAL, Bengaluru, Karnataka 560037, India",,,Transport
ST. MARRY SCHOOL,Day Schools,160,Nursery - Class 10,State Board,Co-Education,tel:+918035470244,20000 / Annual,"2J6C+74M, 12th Cross Rd, Pillanna Garden, Stage 3, Kadugondanahalli, Bengaluru, Karnataka 560084, India",,,
Sri Shaarade Vidyaniketan,2008,Day Schools,N/A,Nursery - Class 10,State Board,tel:+918035470244,40000 / Annual,"50 Feet Main Road, stage 2, Kumaraswamy Layout, Bangalore Urban, Stage 2, Kumaraswamy Layout, Bengaluru, Karnataka 560078, India",,,Transport
MADONNA SCHOOL,1995,Day Schools,350,Nursery - Class 10,State Board,tel:+918035470244,40000 / Annual,"No 56, Indira Gandhi, 1st Main Rd, Udayanagar Extension, Mahadevapura, Bengaluru, Karnataka 560016, India",,,Transport
Alfa Public School,2005,Public Schools,320,LKG - 10,CBSE,tel:+919513238818,22200,"#237, 8th Cross Road, Pillanna Garden, 1st Stage, St. Thomas Town Post, Sagayapura, Richards Town, Bengaluru, Karnataka 560084",,"Cricket, Skating, Swimming, Volleyball","Transport, Medical Facility, Laboratory, Smart Classrooms, Computers Facility, Library"
Deccan International School,2003,Day Schools,1270,Nursery - Class 12,"IGCSE, ICSE",tel:+918035470244,90000 / Annual,"11, 18th Main Rd, Brindavan Layout, Padmanabhanagar, Bengaluru, Karnataka 560061, India",,,Transport
Little Elly Preschool,2004,Play Schools,N/A,Pre School - PRE,Other Boards,tel:+919513238818,27000,"No. 41, Kalena Agrahara,2nd Main Landmark :, Bannerghatta Main Rd, near Meenakshi Temple, 2nd Sector, Nobo Nagar, Bengaluru, Karnataka 560076",Mr. Vittal Bhandary Principal / N/A,Yoga,
SHALINI ENGLISH HIGH SCHOOL,1989,Day Schools,500,Nursery - Class 12,ICSE,tel:+918035470244,20000 / Annual,"1081 Siddaramappa Garden, Lingarajapura Village, Lingarajapuram, Bengaluru, Karnataka 560084, India",,,Transport
Kidzee,2003,Play Schools,55,Pre School - PRE,Other Boards,tel:+919513238818,20000,"H. No. 11& 12, Reservoir St, near BWSSB office, Kumara Park West, Seshadripuram, Bengaluru, Karnataka 560020",Dr. Subhash Chandra Chairman / N/A,Yoga,
Podar Jumbo Kids Plus,1927,Play Schools,N/A,Pre School - PRE,Other Boards,tel:+919513238818,48000,"9th Cross Rd, Kumarapark West, Kumara Park West, Seshadripuram, Bengaluru, Karnataka 560020",,Yoga,
Windermere Public School,Day Schools,N/A,Nursery - Class 10,"ICSE, State Board",Co-Education,tel:+918035470244,60000 / Annual,"3rd Cross Magadi Rd, Keshava Nagar, Binnipete, Bengaluru, Karnataka 560023, India",,,Transport
VENUS INTERNATIONAL SCHOOL,1995,Day Schools,650,Nursery - Class 10,ICSE,tel:+918035470244,85000 / Annual,"Venus International School, 19A, 19/2 - 1, Kodi Basavana Temple St, 6th Block, Rajajinagar, Bengaluru, Karnataka 560010, India",,,Transport
TILAK MEMORIAL ENGLISH HIGH SCHOOL,Day Schools,N/A,Nursery - Class 10,State Board,Co-Education,tel:+918035470244,25000 / Annual,"26, 1st Cross Rd, Keshava Nagar, Binnipete, Bengaluru, Karnataka 560023, India",,,
The Tree House,N/A,Play Schools,N/A,Pre School - PRE,Other Boards,tel:+919513238818,28000,"No 16/12, Binny Cres Rd, Byadarahalli, Benson Town, Bengaluru, Karnataka 560046",,Yoga,
GOOD SAMARITAN PUBLIC SCHOOL,2000,Day Schools,N/A,Nursery - Class 5,"ICSE, State Board",tel:+918035470244,30000 / Annual,"XMFH+6XX, Muniswamappa Layout, Vignan Nagar, Doddanekundi, Kaggadasapura, Bengaluru, Karnataka 560075, India",,,Transport
VIBGYOR ROOTS & RISE,2004,Day Schools,300,Pre-Nursery - Class 12,CBSE,tel:+918035470244,113900 / Annual,"No. 84/3, Silver Woods Main Road Next Apartment, Vaswani Reserve, New Kaverappa Layout, Kadubeesanahalli, Panathur, Bengaluru, Karnataka 560103, India",,,
Martin Luther Public School,2000,Day Schools,987,Pre-Nursery - Class 10,"CBSE, State Board",tel:+918035470244,22800 / Annual,"15th Main Rd, Girinagar Ext, Nagendra Block, Banashankari 1st Stage, Banashankari, Bengaluru, Karnataka 560050, India",,,Transport
JNANA DEEPTHI PUBLIC SCHOOL,Day Schools,150,Nursery - Class 10,State Board,Co-Education,tel:+918035470244,45000 / Annual,"No. 56, 6th Main Rd, Avalahalli, Banashankari 3rd Stage, Banashankari, Bengaluru, Karnataka 560085, India",,,
MOTHER MARYS ENGLISH SCHOOL,Day Schools,N/A,-,Other Boards,Co-Education,tel:+918035470244,2920 / Annual,"1st Main, Ramaiah Reddy Layout, Chikka Banaswadi Rd, Chikka Banaswadi, OMBR Layout, Banaswadi, Bengaluru, Karnataka 560043, India",,,
New Horizon International School,2022,International Schools,1000 approx,Pre School - 9,"CBSE, Cambridge IGCSE",tel:+919513238818,"1,54,900-2,21,900","New Horizon International School, Hennur Main Road, Kothanur, Bengaluru, Karnataka - 560077",,"Athletics, Badminton, Basketball, Carroms, Chess, Cricket, Football, Kabaddi, Karate, Kho-Kho, Skating, Table-tennis, Tennis, Throwball, Volleyball, Yoga","Transport, Medical Facility, Laboratory, Smart Classrooms, Computers Facility, Library"
Bangalore International School,1969,International Schools,950,LKG - 12,"International Baccalaureate, Cambridge IGCSE",tel:+919513238818,200000,"Hennur Bagalur Road, Kothanur Post, Geddalahalli, Bengaluru, Karnataka 560077",,"Basketball, Chess, Cricket, Football, Swimming, Tennis, Throwball","Transport, Medical Facility, Laboratory, Smart Classrooms, Computers Facility, Library"
Vibgyor High School,2004,Public Schools,N/A,1 - 9,"ICSE, Other Boards",tel:+919513238818,110000,"Survey No. 60/1-60/2, Byrathi Village, Blessing Garden Layout, Near Cratis Hospital, Gedhalahalli, Hennur Main Rd, Bengaluru, Karnataka 560077",Rustom Kerawalla Founder Chairman VIBGYOR Group of Schools / N/A,"Basketball, Carroms, Chess, Cricket, Football, Gymnastics, Handball, Kabaddi, Kho-Kho, Skating, Swimming, Table-tennis, Throwball, Yoga","Transport, Laboratory, Smart Classrooms, Computers Facility, Library"
HMR International School,2017,International Schools,,Pre School - 10,CBSE,tel:+919513238818,,"9th Main, 11th Cross, Maruthi Layout,
HBR Layout 4th Block,
Hennur Gardens,
Bengaluru,
Karnataka 560043",Ms.Ashwini Anand Principal / .,"Carroms, Chess","Transport, Medical Facility, Laboratory, Smart Classrooms, Computers Facility"
Orchids International School,2017,International Schools,500,Pre School - 8,CBSE,tel:+919513238818,,"International Airport, No 25/4, Byrathi-Kyalasanahalli, Kothanur post Opp Hennur - Bagalur, Link Road, Bengaluru, Karnataka 560077",,"Badminton, Basketball, Carroms, Chess, Cricket, Football","Transport, Medical Facility, Laboratory, Smart Classrooms, Computers Facility, Library"
Royale Concorde International School,N/A,International Schools,N/A,LKG - 12,CBSE,tel:+919513238818,100000,"Krishnananda Rd, Babusabpalya, Hennur Gardens, Bengaluru, Karnataka 560043",Mr. L.R.Shivarame Gowda Founder Chairperson / N/A,"Badminton, Basketball, Carroms, Chess, Cricket, Football, Hockey, Kabaddi, Kho-Kho, Lawn Tennis, Table-tennis, Tennis, Throwball, Volleyball, Yoga","Transport, Medical Facility, Laboratory, Smart Classrooms, Computers Facility, Library"
Orchids The International School,"International Schools, Public Schools",,Pre School - 12,CBSE,Co-Education,tel:+918035470244,,,,"Athletics, Badminton, Basketball, Football, Gymnastics, Table-tennis, Yoga","Transport, Medical Facility, Laboratory, Smart Classrooms, Computers Facility, Library"
Legacy School,1984,International Schools,60,LKG - 12,"International Baccalaureate, IGCSE",tel:+919513238818,450000,"6/1A, 6/2 Byrathi Village, Bidarahalli Hobli, Off Hennur-Bagalur Main Road (New, International Airport Link Road), Bengaluru, Karnataka 560077",,"Badminton, Basketball, Carroms, Chess, Cricket, Football, Hockey, Ice-Hockey, Kabaddi, Karate, Kho-Kho, Table-tennis, Tennis, Throwball, Yoga","Transport, Laboratory, Smart Classrooms, Computers Facility, Library"
Kidzee,2003,Play Schools,N/A,Pre School - PRE,Other Boards,tel:+919513238818,50000,"K Narayanapura Main Road, Near Kristu Jayanthi College, Off Hennur Main Road, Kothanur, Bengaluru, Karnataka 560077",Dr. Subhash Chandra Chairman / N/A,Yoga,
Broadvision World School,2020,Public Schools,,LKG - 10,CBSE,tel:+919513238818,,"29/3B,HENNUR GARDEN, ROAD CROSS, near DMart, Punappa Layout, Hennur Gardens, Bengaluru, Karnataka 560043, India",,"Athletics, Badminton, Basketball, Carroms, Chess, Football","Transport, Medical Facility, Laboratory, Smart Classrooms, Computers Facility, Library"
Notre Dame Academy,Day Schools,N/A,Nursery - Class 12,ICSE,Co-Education,tel:+918035470244,110000 / Annual,"Notre Dame Nagar, Choodasandra, Huskur, PO, Choodasandra, Bengaluru, Karnataka 560099, India",,,Transport
Primus Public School,Day Schools,N/A,KG - Class 10,"IGCSE, ICSE",Co-Education,tel:+918035470244,124000 / Annual,"Chikkanayakanahalli, Choodasandra, Bengaluru, Karnataka 560035, India",,,Transport
The Vrukksha School,2018,Public Schools,N/A,Pre School - 12,CBSE,tel:+918035470244,,"No. 129, Rayasandra Village Sarjapura Hobli, Anekal Taluk, Bangalore - 560099.",,,
Prathama montessori,2018,Play Schools,N/A,Pre School - 6,Montessori,tel:+918035470244,,"138/2, Rayasandra main road,Next to LGCL Bamboo Forest View,Rayasandra Bangalore -560099",,,
Prakriya Green Wisdom,1999,Day Schools,N/A,Pre-Nursery - Class 12,ICSE,tel:+918035470244,190000 / Annual,"70, Chikkanayakanahalli Road, Sarjapur Main Rd, Off, Doddakannelli, Bengaluru, Karnataka 560035, India",,,Transport
New Horizon Gurukul Pre School,2012,"Play Schools, Public Schools",,Pre School - UKG,CBSE,tel:+919513238818,42100 - 56900,"124/2, Bhoganahalli Main Road, Bellandur Post, Bangalore-560103, India",,,"Transport, Medical Facility, Smart Classrooms, Library"
GEAR Innovative International School,1995,Day Schools,650,Nursery - Class 12,"CBSE, IGCSE",tel:+918035470244,140000 / Annual,"Off Outer Ring Road, 175, Gear School Rd, Adarsh Palm Retreat, Bellandur, Bengaluru, Karnataka 560035, India",,,Transport
St. Dominics School,Day Schools,N/A,Nursery - Class 10,ICSE,Co-Education,tel:+918035470244,20000 / Annual,"Chikkalasandra, WH82+36H, Dr Shivaram Karanth Road, Sarvabhouma Nagar, Subramanyapura, Bengaluru, Karnataka 560061, India",,,
SRI CHAITANYA TECHNO SCHOOL,2013,Day Schools,1215,Pre-Nursery - Class 12,CBSE,tel:+918035470244,65000 / Annual,"Plot No:79, Srinivasa Complex, Seshadripuram Main Rd, near Fortis Hospital, Basappa Garden, Sripuram, TR Layout, Seshadripuram, Bengaluru, Karnataka 560020, India",,,Transport
Orchids The International School,2018,Public Schools,75000+,Pre School - 12,CBSE,tel:+918035470244,"1,20,000 - 3,00,000","76, 6, Mysore Rd, opp. R.V.Engineering College, Harsha Layout, Kengeri Satellite Town, Bengaluru, Karnataka 560059, India",Ms. Leena Pascal Principal / .,"Athletics, Basketball, Carroms, Chess, Cricket, Football, Gymnastics, Karate, Lawn Tennis, Swimming, Table-tennis, Volleyball, Yoga","Transport, Medical Facility, Laboratory, Smart Classrooms, Computers Facility, Library"
Orchids International School,2003,International Schools,600,Pre School - 12,CBSE,tel:+919513238818,,"76, 6, Mysore Rd, opp. R.V.Engineering College, Harsha Layout, Kengeri Satellite Town, Bengaluru, Karnataka 560059, India",,"Badminton, Carroms, Chess, Cricket, Football","Transport, Medical Facility, Laboratory, Smart Classrooms, Computers Facility, Library"
Hello Kids,2005,Play Schools,130,Pre School - PRE,Other Boards,tel:+919513238818,48000,"NICE Ring Rd, Shushruthi Nagar, Basapura, Bengaluru, Karnataka 560068",,Yoga,"Transport, Smart Classrooms"
NEW BRILLIANT SCHOOL,Day Schools,600,Nursery - Class 10,"State Board, Other Boards, State Board",Co-Education,tel:+918035470244,30000 / Annual,"21-22, Uday Shankar Road, A Narayanapura, Udaya Nagar, Mahadevapura, Bengaluru, Karnataka 560016, India",,,Transport
POORNA PRAGATI VIDYA MANDIR ASSOCIATION,Day Schools,N/A,-,State Board,Co-Education,tel:+918035470244,15000 / Annual,"Sannidhana Of Shree Krishna, Durga Devi, Mukhyaprana, Madhwacharyaru, Vadirajaru , Raghavendraru, Rudra Devaru, Naga Devaru, Maha Ganapati, Navagrahas (Temple Complex) POORNAPRAJNA VIDYAPEETHA, WHM6+G8W, Kathriguppe Main Rd, Vidyapeeta Layout, Banashankari 3rd Stage, Banashankari, Bengaluru, Karnataka 560028, India",,,
SHRI MAITRI ENGLISH SCHOOL,1989,Day Schools,500,Nursery - Class 10,State Board,tel:+918035470244,40000 / Annual,"106/3, 4th Main Nehru Rd, A Narayanapura, MEG Layout, Udaya Nagar, Mahadevapura, Bengaluru, Karnataka 560016, India",,,
Vidya Vikas School,2004,Day Schools,N/A,Nursery - Class 10,State Board,tel:+918035470244,35000 / Annual,"Vidya Vikas School Rd, Kaverappa Layout, Kadubeesanahalli, Bengaluru, Karnataka 560103, India",,,Transport
Geetanjali Olympiad School,2012,Day Schools,770,Nursery - Class 10,CBSE,tel:+918035470244,60000 / Annual,"WMPX+FR3, Kaverappa Layout, Kadubeesanahalli, Bengaluru, Karnataka 560103, India",,,Transport
DEODATE PUBLIC SCHOOL,2004,Day Schools,800,Pre-Nursery - Class 10,"CBSE, State Board",tel:+918035470244,20000 / Annual,"WH23+6M3, Banashankari 5th Stage, Subramanyapura, Bengaluru, Karnataka 560078, India",,,Transport
REPUBLIC ENGLISH HIGH SCHOOL,1996,Day Schools,N/A,Class 1 - Class 10,State Board,tel:+918035470244,20000 / Annual,"2nd Main Rd, Bilal Nagar, Sagayapura, Richards Town, Bengaluru, Karnataka 560084, India",,,
